{
  "$schema": "../../../../schemas/user-experience-handler-plan.schema.json",
  "schemaVersion": 1,
  "handlerId": "default-apps-current-user",
  "handlerType": "default-apps",
  "scope": "current-user",
  "mode": "fixture",
  "source": "fixture",
  "templateMetadataId": "default-apps-reference-24h2",
  "supportStatus": "manual-or-future",
  "verificationMode": "manual-checklist",
  "requestedApply": false,
  "executed": false,
  "status": "manual",
  "associations": [
    { "progId": "Sample.Browser.HTML", "knownCapability": true }
  ]
}
