{
  "$schema": "../../../../schemas/user-experience-handler-plan.schema.json",
  "schemaVersion": 1,
  "handlerId": "taskbar-current-user",
  "handlerType": "taskbar",
  "scope": "current-user",
  "mode": "fixture",
  "source": "fixture",
  "templateMetadataId": "",
  "supportStatus": "manual-or-future",
  "verificationMode": "manual-checklist",
  "requestedApply": false,
  "executed": false,
  "status": "manual",
  "pins": [
    { "displayName": "Sample Explorer", "appUserModelId": "Sample.Explorer_12345!App" }
  ]
}
