{
  "$schema": "../../../../schemas/user-experience-handler-plan.schema.json",
  "schemaVersion": 1,
  "handlerId": "start-menu-current-user",
  "handlerType": "start-menu",
  "scope": "current-user",
  "mode": "fixture",
  "source": "fixture",
  "templateMetadataId": "start-menu-reference-24h2",
  "supportStatus": "manual-or-future",
  "verificationMode": "manual-checklist",
  "requestedApply": false,
  "executed": false,
  "status": "manual",
  "pins": [
    { "displayName": "Sample Browser", "appUserModelId": "Sample.Browser_12345!App" }
  ]
}
